{
  "definitionLevel": "indexed",
  "contentType": "operations.decision",
  "schemaVersion": "1.0",
  "index": {
    "title": "Revised rollout decision after monitoring feedback",
    "domain": "operations",
    "contentType": "operations.decision",
    "concepts": [
      "decision-evolution",
      "adaptation",
      "human-review"
    ],
    "entities": [
      "customer-support-automation"
    ],
    "status": "scope-reduced"
  },
  "data": {
    "decisionId": "ops-rollout-2026-001-r1",
    "artifactRole": "revised-rollout-decision",
    "summary": "Rollout remains active but scope is reduced after monitoring revealed elevated edge-case failures.",
    "subject": {
      "system": "customer-support-automation",
      "scope": "5% of low-risk tickets excluding cancellation-policy exceptions"
    },
    "decision": {
      "outcome": "continue-with-reduced-scope",
      "status": "scope-reduced",
      "decisionOwner": "operations-lead",
      "effectiveDate": "2026-04-15",
      "supersedesDecisionId": "ops-rollout-2026-001"
    },
    "rationale": {
      "summary": "New evidence and revised policy support continuing the rollout with narrower scope and added human review.",
      "basis": [
        {
          "artifactRole": "initial-rollout-decision",
          "usedFor": [
            "prior approved scope",
            "original guardrails"
          ]
        },
        {
          "artifactRole": "post-rollout-monitoring-report",
          "usedFor": [
            "observed failure increase",
            "review trigger"
          ]
        },
        {
          "artifactRole": "revised-rollout-policy",
          "usedFor": [
            "new routing requirement",
            "scope hold rule"
          ]
        }
      ]
    },
    "findings": [
      {
        "id": "finding-004",
        "finding": "Decision changed because live evidence invalidated part of the original operating assumption.",
        "status": "supported"
      }
    ],
    "conditions": [
      {
        "id": "condition-004",
        "requirement": "Exclude cancellation-policy exceptions from automation until reviewed by humans.",
        "status": "required-during-rollout",
        "owner": "support-operations",
        "evidenceRequired": "routing rule export"
      }
    ],
    "risks": [
      {
        "id": "risk-003",
        "risk": "Residual failures may persist in other edge cases.",
        "severity": "medium",
        "status": "monitor",
        "mitigation": "Continue weekly monitoring and preserve escalation threshold triggers."
      }
    ],
    "actions": [
      {
        "id": "action-003",
        "type": "reduce-scope",
        "description": "Reduce automation scope from 10% to 5%.",
        "owner": "support-operations",
        "requiredBefore": "next-shift",
        "status": "open"
      },
      {
        "id": "action-004",
        "type": "configure-human-review",
        "description": "Add human review routing for cancellation-policy exceptions.",
        "owner": "support-engineering",
        "requiredBefore": "continued-rollout",
        "status": "open"
      }
    ]
  }
}
