{
  "definitionLevel": "indexed",
  "contentType": "governance.release-decision",
  "schemaVersion": "1.0",
  "index": {
    "title": "Policy QA model release readiness decision",
    "domain": "model-governance",
    "contentType": "governance.release-decision",
    "concepts": [
      "release",
      "auditability",
      "evaluation"
    ],
    "entities": [
      "policy-qa-model"
    ],
    "status": "ready-for-staged-release"
  },
  "data": {
    "decisionId": "model-release-2026-003",
    "summary": "Policy QA model candidate is ready for a staged rollout after meeting release thresholds and human review requirements.",
    "subject": {
      "model": "policy-qa-model",
      "candidate": "2026-05-18"
    },
    "decision": {
      "outcome": "ready-for-staged-release",
      "status": "approved",
      "deploymentScope": "10% staged rollout",
      "decisionOwner": "model-risk-review-board",
      "nextReviewTrigger": "post-rollout-monitoring-window"
    },
    "rationale": {
      "summary": "The evaluation run remains within the release thresholds and the required human review was completed.",
      "basis": [
        {
          "artifactRole": "evaluation-run",
          "usedFor": [
            "critical failure count",
            "high-severity failure count",
            "regression status"
          ]
        },
        {
          "artifactRole": "release-gating-policy",
          "usedFor": [
            "threshold comparison",
            "human review requirement"
          ]
        }
      ]
    },
    "conditions": [
      {
        "id": "condition-004",
        "requirement": "Run daily regression scans during the staged rollout.",
        "status": "required-during-rollout",
        "owner": "model-operations",
        "evidenceRequired": "daily evaluation report"
      }
    ],
    "risks": [
      {
        "id": "risk-004",
        "risk": "High-severity failures may cluster in unseen edge cases during rollout.",
        "severity": "medium",
        "status": "accepted-with-monitoring",
        "mitigation": "Use staged rollout and daily regression scans."
      }
    ],
    "actions": [
      {
        "id": "action-005",
        "type": "deploy-staged-release",
        "description": "Deploy candidate to 10% of production traffic.",
        "owner": "model-operations",
        "requiredBefore": "rollout-start",
        "status": "open"
      },
      {
        "id": "action-006",
        "type": "monitor-regressions",
        "description": "Run daily regression scans during rollout.",
        "owner": "model-evaluation",
        "requiredBefore": "rollout-complete",
        "status": "open"
      }
    ]
  }
}
