{
  "definitionLevel": "indexed",
  "contentType": "research.synthesis",
  "schemaVersion": "1.0",
  "index": {
    "title": "Q2 infrastructure synthesis for verifiable artifacts",
    "domain": "market-research",
    "contentType": "research.synthesis",
    "concepts": [
      "lineage",
      "receipts",
      "interoperability"
    ],
    "entities": [
      "enterprise-ai-market"
    ],
    "status": "ready-for-review"
  },
  "data": {
    "decisionId": "research-synthesis-2026-q2",
    "summary": "Demand is strongest for artifacts that remain inspectable after leaving the source platform.",
    "subject": {
      "segment": "enterprise AI infrastructure"
    },
    "decision": {
      "outcome": "recommend-positioning",
      "status": "ready-for-review",
      "decisionOwner": "market-research"
    },
    "rationale": {
      "summary": "Both the market scan and buyer interviews point toward portability, verification, and explicit completeness as differentiators.",
      "basis": [
        {
          "artifactRole": "market-scan",
          "usedFor": [
            "competitive landscape",
            "feature prevalence"
          ]
        },
        {
          "artifactRole": "buyer-interview-synthesis",
          "usedFor": [
            "buyer priorities",
            "workflow pain points"
          ]
        }
      ]
    },
    "findings": [
      {
        "id": "finding-007",
        "finding": "Portable receipts reduce review friction.",
        "status": "supported"
      },
      {
        "id": "finding-008",
        "finding": "Cross-tool lineage is easier to evaluate than platform-specific logs.",
        "status": "supported"
      }
    ],
    "conditions": [],
    "risks": [
      {
        "id": "risk-003",
        "risk": "Market messaging may drift toward platform replacement rather than composability.",
        "severity": "medium",
        "status": "monitor",
        "mitigation": "Keep product examples artifact-first and integration-neutral."
      }
    ],
    "actions": [
      {
        "id": "action-004",
        "type": "positioning-update",
        "description": "Lead with verified lineage and portable receipts in external messaging.",
        "owner": "product-strategy",
        "requiredBefore": "next-public-brief",
        "status": "open"
      }
    ]
  }
}
