{
  "definitionLevel": "indexed",
  "contentType": "finance.invoice.decision",
  "schemaVersion": "1.0",
  "index": {
    "title": "Quarterly invoice approval decision",
    "domain": "finance",
    "contentType": "finance.invoice.decision",
    "concepts": [
      "invoice-approval",
      "control-check",
      "payment-release"
    ],
    "entities": [
      "Harbor Cloud Services"
    ],
    "status": "approved-for-payment"
  },
  "data": {
    "decisionId": "ap-review-2026-014",
    "summary": "Quarterly invoice approved for payment after threshold and purchase-order checks passed.",
    "subject": {
      "vendor": "Harbor Cloud Services",
      "invoiceNumber": "HCS-2026-Q2-014",
      "invoiceTotalUsd": 482000
    },
    "decision": {
      "outcome": "approve-payment",
      "status": "approved-for-payment",
      "decisionOwner": "finance-controller",
      "effectiveDate": "2026-05-18"
    },
    "rationale": {
      "summary": "The invoice amount matched the purchase order and exceeded the threshold requiring controller review, which was completed.",
      "basis": [
        {
          "artifactRole": "invoice-source",
          "usedFor": [
            "invoice amount",
            "vendor identity",
            "invoice number"
          ]
        },
        {
          "artifactRole": "accounts-payable-policy",
          "usedFor": [
            "approval threshold",
            "required review path"
          ]
        }
      ]
    },
    "conditions": [],
    "risks": [
      {
        "id": "risk-001",
        "risk": "Payment release after approval remains subject to bank-file controls.",
        "severity": "low",
        "status": "accepted",
        "mitigation": "Use standard payment release workflow."
      }
    ],
    "actions": [
      {
        "id": "action-001",
        "type": "release-payment",
        "description": "Release approved invoice to the payment queue.",
        "owner": "accounts-payable",
        "requiredBefore": "payment-run",
        "status": "open"
      }
    ]
  }
}
