{
  "definitionLevel": "indexed",
  "contentType": "privacy.review.decision",
  "schemaVersion": "1.0",
  "index": {
    "title": "Conditional approval with unresolved partner boundary",
    "domain": "privacy",
    "contentType": "privacy.review.decision",
    "concepts": [
      "external-boundary",
      "partial-verification",
      "data-sharing"
    ],
    "entities": [
      "partner analytics exchange"
    ],
    "status": "awaiting-external-evidence"
  },
  "data": {
    "decisionId": "privacy-review-2026-004",
    "summary": "Internal requirements are satisfied, but full lineage remains incomplete until the partner data-protection assessment is provided.",
    "subject": {
      "system": "partner analytics exchange"
    },
    "decision": {
      "outcome": "approve-pending-external-review",
      "status": "awaiting-external-evidence",
      "decisionOwner": "privacy-engineering",
      "nextReviewTrigger": "partner-assessment-received"
    },
    "rationale": {
      "summary": "The resolved internal assessment supports a limited approval, while the partner assessment remains outside the supplied graph.",
      "basis": [
        {
          "artifactRole": "internal-data-minimization-assessment",
          "usedFor": [
            "approved data classes",
            "retention limit"
          ]
        },
        {
          "artifactRole": "partner-data-protection-assessment",
          "usedFor": [
            "processor controls",
            "cross-border transfer review"
          ],
          "resolution": "external"
        }
      ]
    },
    "conditions": [
      {
        "id": "condition-001",
        "requirement": "Obtain the partner data-protection assessment before claiming complete verification.",
        "status": "required-before-full-validation",
        "owner": "privacy-engineering",
        "evidenceRequired": "partner assessment Block"
      }
    ],
    "risks": [
      {
        "id": "risk-001",
        "risk": "The unresolved partner boundary may contain controls that affect the final approval posture.",
        "severity": "medium",
        "status": "open-boundary",
        "mitigation": "Keep the decision partial until the partner assessment is resolved."
      }
    ],
    "actions": [
      {
        "id": "action-001",
        "type": "collect-evidence",
        "description": "Request the partner data-protection assessment package.",
        "owner": "privacy-engineering",
        "requiredBefore": "full-validation",
        "status": "open"
      }
    ]
  }
}
